{
  "contract_version": "ivk-source-plan-1.0",
  "created_at": "2026-08-23T22:59:58.955587+00:00",
  "value_chain": {
    "name": "kr_tse_write_validation",
    "slug": "kr-tse-write-validation",
    "operation": "new",
    "target_vc": null
  },
  "blueprint_contract": "ivk-blueprint-1.0",
  "pack_manifest": {
    "frame": "sponsor_valuechain_bottleneck@1.0.0",
    "sector": "semiconductor_optical@1.0.0",
    "regions": [
      "kr@1.0.0"
    ]
  },
  "pack_policy": {
    "mode": "reused",
    "requested_sector": "semiconductor_optical",
    "reusable_sector_pack": true,
    "core_revision_required": false,
    "review_status": "accepted_for_planning"
  },
  "evidence_policy": {
    "primary_source_first": true,
    "reuse_by_content_hash": true,
    "auto_confirm": false,
    "canonical_graph_read": "neo4j-official.read_cypher"
  },
  "tasks": [
    {
      "seed": "KR:131290",
      "task_type": "evidence_collection",
      "priority": 2,
      "identity": {
        "canonical_id": "KR:131290",
        "ticker": "131290",
        "company_name": "티에스이",
        "market": "kr",
        "exchange": null,
        "provider": "dart",
        "provider_ids": {
          "dart": "131290"
        },
        "company_node_id": "company:tse"
      },
      "topics": [
        "demand_driver",
        "sponsor",
        "system",
        "process",
        "component",
        "bottleneck",
        "beneficiary",
        "company_profile",
        "products",
        "processes",
        "technologies",
        "end_markets",
        "customers",
        "capacity",
        "quarterly_financials",
        "inventory"
      ],
      "source_adapters": [
        "dart",
        "company_ir"
      ]
    },
    {
      "seed": null,
      "task_type": "question_evidence",
      "priority": 3,
      "requirement_id": "question:1",
      "question": "기존 티에스이 Company ID를 유지하면서 후보 Value Chain에 연결되는가?",
      "source_adapters": [
        "dart",
        "company_ir"
      ]
    }
  ],
  "token_budgets": {
    "source_planning": 5000,
    "evidence_extraction": 50000,
    "synthesis": 15000,
    "exception_review": 10000,
    "final_report": 5000
  },
  "stop_conditions": [
    "unsupported_bottleneck",
    "no_primary_source"
  ],
  "status": "planned"
}
