{
  "contract_version": "ivk-source-plan-1.0",
  "created_at": "2026-08-23T01:51:36.424195+00:00",
  "value_chain": {
    "name": "US optic Ecosystem",
    "slug": "us-optic-ecosystem",
    "operation": "new",
    "target_vc": null
  },
  "blueprint_contract": "ivk-blueprint-1.0",
  "pack_manifest": {
    "frame": "matrix@1.0.0",
    "sector": "bootstrap_optical_communications@0.0.0",
    "regions": [
      "us@1.0.0"
    ]
  },
  "pack_policy": {
    "mode": "bootstrap",
    "requested_sector": "optical_communications",
    "reusable_sector_pack": false,
    "core_revision_required": false,
    "review_status": "bootstrap_pending"
  },
  "evidence_policy": {
    "primary_source_first": true,
    "reuse_by_content_hash": true,
    "auto_confirm": false,
    "canonical_graph_read": "neo4j-official.read_cypher"
  },
  "tasks": [
    {
      "seed": "LITE",
      "task_type": "entity_resolution",
      "priority": 1,
      "topics": [
        "identity",
        "exchange",
        "ticker"
      ],
      "source_adapters": [
        "tikr",
        "sec",
        "company_ir",
        "earnings_call"
      ]
    },
    {
      "seed": "LITE",
      "task_type": "evidence_collection",
      "priority": 2,
      "topics": [
        "cluster_members",
        "clustering_basis",
        "comparison_axes",
        "shared_driver",
        "differentiators"
      ],
      "source_adapters": [
        "tikr",
        "sec",
        "company_ir",
        "earnings_call"
      ]
    },
    {
      "seed": "CRDO",
      "task_type": "entity_resolution",
      "priority": 1,
      "topics": [
        "identity",
        "exchange",
        "ticker"
      ],
      "source_adapters": [
        "tikr",
        "sec",
        "company_ir",
        "earnings_call"
      ]
    },
    {
      "seed": "CRDO",
      "task_type": "evidence_collection",
      "priority": 2,
      "topics": [
        "cluster_members",
        "clustering_basis",
        "comparison_axes",
        "shared_driver",
        "differentiators"
      ],
      "source_adapters": [
        "tikr",
        "sec",
        "company_ir",
        "earnings_call"
      ]
    },
    {
      "seed": "COHR",
      "task_type": "entity_resolution",
      "priority": 1,
      "topics": [
        "identity",
        "exchange",
        "ticker"
      ],
      "source_adapters": [
        "tikr",
        "sec",
        "company_ir",
        "earnings_call"
      ]
    },
    {
      "seed": "COHR",
      "task_type": "evidence_collection",
      "priority": 2,
      "topics": [
        "cluster_members",
        "clustering_basis",
        "comparison_axes",
        "shared_driver",
        "differentiators"
      ],
      "source_adapters": [
        "tikr",
        "sec",
        "company_ir",
        "earnings_call"
      ]
    },
    {
      "seed": "AAOI",
      "task_type": "entity_resolution",
      "priority": 1,
      "topics": [
        "identity",
        "exchange",
        "ticker"
      ],
      "source_adapters": [
        "tikr",
        "sec",
        "company_ir",
        "earnings_call"
      ]
    },
    {
      "seed": "AAOI",
      "task_type": "evidence_collection",
      "priority": 2,
      "topics": [
        "cluster_members",
        "clustering_basis",
        "comparison_axes",
        "shared_driver",
        "differentiators"
      ],
      "source_adapters": [
        "tikr",
        "sec",
        "company_ir",
        "earnings_call"
      ]
    },
    {
      "seed": null,
      "task_type": "question_evidence",
      "priority": 3,
      "requirement_id": "question:1",
      "question": "각 seed 기업의 핵심 제품, 기능 및 Value Chain 역할은 무엇인가?",
      "source_adapters": [
        "tikr",
        "sec",
        "company_ir",
        "earnings_call"
      ]
    },
    {
      "seed": null,
      "task_type": "question_evidence",
      "priority": 3,
      "requirement_id": "question:2",
      "question": "기업들이 공유하는 수요동인과 End Market은 무엇인가?",
      "source_adapters": [
        "tikr",
        "sec",
        "company_ir",
        "earnings_call"
      ]
    },
    {
      "seed": null,
      "task_type": "question_evidence",
      "priority": 3,
      "requirement_id": "question:3",
      "question": "핵심 공정·제품·기술 병목은 어디에 있는가?",
      "source_adapters": [
        "tikr",
        "sec",
        "company_ir",
        "earnings_call"
      ]
    },
    {
      "seed": null,
      "task_type": "question_evidence",
      "priority": 3,
      "requirement_id": "question:4",
      "question": "병목의 직접 및 간접 수혜기업은 누구인가?",
      "source_adapters": [
        "tikr",
        "sec",
        "company_ir",
        "earnings_call"
      ]
    },
    {
      "seed": null,
      "task_type": "question_evidence",
      "priority": 3,
      "requirement_id": "question:5",
      "question": "최근 5분기 실적, 사업부, 재고, 마진 및 증설에서 가설이 확인되는가?",
      "source_adapters": [
        "tikr",
        "sec",
        "company_ir",
        "earnings_call"
      ]
    },
    {
      "seed": null,
      "task_type": "question_evidence",
      "priority": 3,
      "requirement_id": "question:6",
      "question": "추가 조사하거나 제외해야 할 인접 기업과 연결은 무엇인가?",
      "source_adapters": [
        "tikr",
        "sec",
        "company_ir",
        "earnings_call"
      ]
    }
  ],
  "token_budgets": {
    "source_planning": 5000,
    "evidence_extraction": 50000,
    "synthesis": 15000,
    "exception_review": 10000,
    "final_report": 5000
  },
  "stop_conditions": [
    "cluster_members_undefined",
    "comparison_axis_undefined",
    "no_primary_source"
  ],
  "status": "planned"
}
